name,description,location,rating
Bukit Holbung,Bukit hijau yang luas dengan pemandangan Danau Toba dari ketinggian. Sering disebut Bukit Teletubbies karena bentuknya yang unik. Tempat terbaik untuk camping dan melihat matahari terbit.,Samosir,4.9
Air Terjun Sipiso-piso,Salah satu air terjun tertinggi di Indonesia yang jatuh ke kawah Danau Toba. Pemandangannya sangat megah dengan latar belakang pegunungan hijau.,Merek,4.8
Huta Siallagan,Desa adat kuno dengan deretan rumah Bolon dan kursi batu tempat pengadilan raja jaman dulu. Sangat kental dengan sejarah hukum adat Batak.,Samosir,4.7
Menara Pandang Tele,Titik tertinggi untuk melihat seluruh panorama Danau Toba. Dari sini Anda bisa melihat lekukan pulau Samosir dengan sangat jelas.,Samosir,4.6
Pantai Pasir Putih Parbaba,Pantai unik di pinggir danau dengan pasir putih halus. Sangat cocok untuk wisata keluarga dan olahraga air seperti banana boat.,Samosir,4.5
Pusuk Buhit,Gunung sakral yang dipercaya sebagai tempat asal mula bangsa Batak. Jalur trekking yang menantang dengan pemandangan spiritual.,Samosir,4.8